Institute ID,Name,City,State,Score,Rank
IR-L-U-0238,National Law School of India UniversityMore Details |  |,Bengaluru,Karnataka,78.66,1
IR-L-U-0111,National Law UniversityMore Details |  |,New Delhi,Delhi,74.02,2
IR-L-N-18,Nalsar University of LawMore Details |  |,Hyderabad,Telangana,73.12,3
IR-L-U-0573,Indian Institute of Technology KharagpurMore Details |  |,Kharagpur,West Bengal,71.44,4
IR-L-U-0414,National Law UniversityMore Details |  |,Jodhpur,Rajasthan,64.29,5
IR-L-U-0585,The West Bengal National University of Juridicial SciencesMore Details |  |,Kolkata,West Bengal,63.32,6
IR-L-U-0134,Gujarat National Law UniversityMore Details |  |,Gandhinagar,Gujarat,60.78,7
IR-L-C-19328,Symbiosis Law SchoolMore Details |  |,Pune,Maharashtra,59.54,8
IR-L-U-0108,Jamia Millia IslamiaMore Details |  |,New Delhi,Delhi,57.93,9
IR-L-U-0386,The Rajiv Gandhi National University of LawMore Details |  |,Patiala,Punjab,54.19,10
IR-L-U-0511,Dr. Ram Manohar Lohiya National Law UniversityMore Details |  |,Lucknow,Uttar Pradesh,53.57,11
IR-L-U-0356,Kalinga Institute of Industrial TechnologyMore Details |  |,Bhubaneswar,Odisha,52.83,12
IR-L-U-0496,Aligarh Muslim UniversityMore Details |  |,Aligarh,Uttar Pradesh,52.28,13
IR-L-U-0358,National Law UniversityMore Details |  |,Cuttack,Odisha,51.94,14
IR-L-U-0078,Panjab UniversityMore Details |  |,Chandigarh,Chandigarh,51.11,15
IR-L-U-0677,National Law University and Judicial AcademyMore Details |  |,Kamrup,Assam,49.9,16
IR-L-U-0285,"National Law Institute University, BhopalMore Details |  |",Bhopal,Madhya Pradesh,49.6,17
IR-L-U-0103,Indian Law InstituteMore Details |  |,New Delhi,Delhi,49.44,18
IR-L-U-0500,Banaras Hindu UniversityMore Details |  |,Varanasi,Uttar Pradesh,49.17,19
IR-L-U-0217,Christ UniversityMore Details |  |,Bengaluru,Karnataka,48.01,20